id;nom;prenom;sexe;anneeDebutBTS;tel;adrMail;rue;codePostal;ville;entreprise;idFonction;compteAccepte;motDePasse;etudesPostBTS;dateDerniereMAJ;
1;CARTRON;Jean-Michel;H;1990;02.99.87.12.12;jean.michel.cartron@gmail.com;5 rue de la Motte Brulon;35700;RENNES;Lycée De La Salle - Rennes;7;1;d83177daa22aeba3081abf055f98fd39cb8ecf4a;;2015-11-11 22:29:42;
4;FONFEC;Sophie;F;2005;11.22.33.44.55;sophie.fonfec@gmail.com;1, rue de la mairie;35000;RENNES;Orange;1;1;d83177daa22aeba3081abf055f98fd39cb8ecf4a;Bachelor Informatique "Systèmes, Réseaux et Cloud Computing" au Lycée De La Salle;2015-11-15 20:16:48;
5;CARTRON;Jim;H;1990;11.22.33.44.55;jeanmichelcartron@gmail.com;6, rue François Mauriac;35760;St GREGOIRE;Lycée De La Salle - Rennes;7;0;d83177daa22aeba3081abf055f98fd39cb8ecf4a;Bachelor Informatique "Systèmes, Réseaux et Cloud Computing" au Lycée De La Salle;2015-11-16 19:49:05;
6;BOUTIN;Killian;M;2016;01.23.45.67.89;delasalle.sio.boutin.k@gmail.com;5 rue de la Motte brûlon;;;;7;1;d83177daa22aeba3081abf055f98fd39cb8ecf4a;;2016-05-26 14:11:06;
7;BOUTIN;Jean;H;1990;;delasalle.sioboutin.k@gmail.com;;;;;1;1;d83177daa22aeba3081abf055f98fd39cb8ecf4a;;2016-05-27 14:35:00;
